{
  "$schema": "https://json-schema.org/draft/2020-12/schema",
  "$id": "package.schema.json",
  "type": "object",
  "properties": {
    "schema": {
      "const": "pcbknowledge.package.v2"
    },
    "id": {
      "type": "string",
      "minLength": 1,
      "maxLength": 256,
      "pattern": "^package:[a-z0-9][a-z0-9/_-]*$"
    },
    "verification": {
      "$ref": "envelope.schema.json#/$defs/verification"
    },
    "provenance": {
      "$ref": "envelope.schema.json#/$defs/provenance"
    },
    "family": {
      "type": "string",
      "minLength": 1,
      "maxLength": 256
    },
    "body": {
      "type": "object",
      "properties": {
        "length": {
          "oneOf": [
            {
              "$ref": "quantity.schema.json"
            },
            {
              "$ref": "unknown.schema.json"
            }
          ]
        },
        "width": {
          "oneOf": [
            {
              "$ref": "quantity.schema.json"
            },
            {
              "$ref": "unknown.schema.json"
            }
          ]
        },
        "height": {
          "oneOf": [
            {
              "$ref": "quantity.schema.json"
            },
            {
              "$ref": "unknown.schema.json"
            }
          ]
        },
        "center": {
          "type": "object",
          "properties": {
            "x": {
              "$ref": "quantity.schema.json"
            },
            "y": {
              "$ref": "quantity.schema.json"
            }
          },
          "required": [
            "x",
            "y"
          ],
          "additionalProperties": false
        }
      },
      "required": [
        "length",
        "width",
        "height"
      ],
      "additionalProperties": false
    },
    "pin1": {
      "type": "string",
      "minLength": 1,
      "maxLength": 256
    },
    "courtyard_margin": {
      "oneOf": [
        {
          "$ref": "quantity.schema.json"
        },
        {
          "$ref": "unknown.schema.json"
        }
      ]
    },
    "evidence": {
      "type": "array",
      "items": {
        "$ref": "evidence.schema.json"
      },
      "minItems": 0
    },
    "explicit_pads": {
      "type": "array",
      "items": {
        "type": "object",
        "properties": {
          "number": {
            "type": "string",
            "minLength": 1,
            "maxLength": 256
          },
          "kind": {
            "enum": [
              "SMD",
              "THROUGH_HOLE",
              "MECHANICAL"
            ]
          },
          "shape": {
            "enum": [
              "RECT",
              "ROUND",
              "OVAL"
            ]
          },
          "x": {
            "$ref": "quantity.schema.json"
          },
          "y": {
            "$ref": "quantity.schema.json"
          },
          "width": {
            "$ref": "quantity.schema.json"
          },
          "height": {
            "$ref": "quantity.schema.json"
          },
          "drill": {
            "$ref": "quantity.schema.json"
          },
          "rotation": {
            "$ref": "quantity.schema.json"
          },
          "drill_width": {
            "$ref": "quantity.schema.json"
          },
          "drill_height": {
            "$ref": "quantity.schema.json"
          }
        },
        "required": [
          "number",
          "kind",
          "shape",
          "x",
          "y",
          "width",
          "height",
          "rotation"
        ],
        "additionalProperties": false
      },
      "minItems": 1
    },
    "generator": {
      "enum": [
        "chip",
        "molded_diode",
        "gullwing_two_side",
        "gullwing_four_side",
        "crystal_four_pad",
        "pin_header",
        "radial_two_lead",
        "mechanical_hole",
        "manufacturer_two_side_land",
        "manufacturer_four_side_land"
      ]
    },
    "density": {
      "enum": [
        "COMPACT",
        "NOMINAL",
        "ROBUST"
      ]
    },
    "drawing": {
      "type": "object",
      "properties": {
        "lead_span": {
          "$ref": "quantity.schema.json"
        },
        "lead_width": {
          "$ref": "quantity.schema.json"
        },
        "lead_length": {
          "$ref": "quantity.schema.json"
        },
        "pitch": {
          "$ref": "quantity.schema.json"
        },
        "row_pitch": {
          "$ref": "quantity.schema.json"
        },
        "drill": {
          "$ref": "quantity.schema.json"
        },
        "pad_width": {
          "$ref": "quantity.schema.json"
        },
        "pad_height": {
          "$ref": "quantity.schema.json"
        },
        "pin_count": {
          "type": "integer",
          "minimum": 1,
          "maximum": 256
        },
        "row_count": {
          "type": "integer",
          "minimum": 1,
          "maximum": 2
        },
        "pad_numbers": {
          "type": "array",
          "items": {
            "type": "string",
            "minLength": 1
          },
          "minItems": 4,
          "maxItems": 4
        },
        "tab": {
          "type": "object",
          "properties": {
            "number": {
              "type": "string",
              "minLength": 1
            },
            "width": {
              "$ref": "quantity.schema.json"
            }
          },
          "required": [
            "number",
            "width"
          ],
          "additionalProperties": false
        },
        "opposite_lead_length": {
          "$ref": "quantity.schema.json"
        },
        "exposed_pad": {
          "type": "object",
          "properties": {
            "number": {
              "type": "string",
              "minLength": 1,
              "maxLength": 16
            },
            "width": {
              "$ref": "quantity.schema.json"
            },
            "length": {
              "$ref": "quantity.schema.json"
            },
            "paste_margin": {
              "$ref": "quantity.schema.json"
            }
          },
          "required": [
            "number",
            "width",
            "length"
          ],
          "additionalProperties": false
        },
        "terminal_gap": {
          "$ref": "quantity.schema.json"
        }
      },
      "required": [
        "pin_count"
      ],
      "additionalProperties": false
    },
    "scope": {
      "oneOf": [
        {
          "type": "object",
          "properties": {
            "mpns": {
              "type": "array",
              "items": {
                "type": "string",
                "minLength": 1,
                "maxLength": 256
              },
              "minItems": 1,
              "uniqueItems": true
            },
            "basis": {
              "const": "DATASHEET"
            },
            "evidence": {
              "type": "array",
              "items": {
                "$ref": "evidence.schema.json"
              },
              "minItems": 1,
              "uniqueItems": true
            }
          },
          "required": [
            "mpns",
            "basis",
            "evidence"
          ],
          "additionalProperties": false
        },
        {
          "type": "object",
          "properties": {
            "mpns": {
              "type": "array",
              "items": {
                "type": "string",
                "minLength": 1,
                "maxLength": 256
              },
              "minItems": 1,
              "uniqueItems": true
            },
            "basis": {
              "const": "ENGINEERING_DEFAULT"
            },
            "note": {
              "type": "string",
              "minLength": 1,
              "maxLength": 256
            }
          },
          "required": [
            "mpns",
            "basis",
            "note"
          ],
          "additionalProperties": false
        }
      ]
    },
    "mount_type": {
      "enum": [
        "SMT",
        "THT",
        "MECHANICAL"
      ]
    }
  },
  "required": [
    "schema",
    "id",
    "verification",
    "provenance",
    "family",
    "body",
    "pin1",
    "courtyard_margin",
    "evidence",
    "scope",
    "mount_type"
  ],
  "additionalProperties": false,
  "allOf": [
    {
      "oneOf": [
        {
          "properties": {
            "verification": {
              "const": "DRAFT"
            }
          }
        },
        {
          "properties": {
            "verification": {
              "enum": [
                "AGENT_VERIFIED",
                "HUMAN_VERIFIED"
              ]
            },
            "provenance": {
              "properties": {
                "verified_by": {
                  "minItems": 1
                }
              }
            }
          }
        }
      ]
    },
    {
      "oneOf": [
        {
          "required": [
            "drawing",
            "generator",
            "density"
          ],
          "not": {
            "required": [
              "explicit_pads"
            ]
          }
        },
        {
          "required": [
            "explicit_pads"
          ],
          "not": {
            "anyOf": [
              {
                "required": [
                  "drawing"
                ]
              },
              {
                "required": [
                  "generator"
                ]
              },
              {
                "required": [
                  "density"
                ]
              }
            ]
          }
        }
      ]
    }
  ]
}
