{
  "body": {
    "height": {
      "basis": "DATASHEET",
      "conditions": {},
      "evidence": {
        "page": 99,
        "source": "source:st-stm32f103"
      },
      "max": 1.6,
      "unit": "mm"
    },
    "length": {
      "basis": "DATASHEET",
      "conditions": {},
      "evidence": {
        "page": 99,
        "source": "source:st-stm32f103"
      },
      "unit": "mm",
      "value": 7
    },
    "width": {
      "basis": "DATASHEET",
      "conditions": {},
      "evidence": {
        "page": 99,
        "source": "source:st-stm32f103"
      },
      "unit": "mm",
      "value": 7
    }
  },
  "courtyard_margin": {
    "basis": "ENGINEERING_DEFAULT",
    "conditions": {},
    "note": "G1 D8 courtyard allowance.",
    "unit": "mm",
    "value": 0.25
  },
  "density": "NOMINAL",
  "drawing": {
    "lead_length": {
      "basis": "DATASHEET",
      "conditions": {},
      "evidence": {
        "page": 99,
        "source": "source:st-stm32f103"
      },
      "max": 0.75,
      "min": 0.45,
      "typ": 0.6,
      "unit": "mm"
    },
    "lead_span": {
      "basis": "DATASHEET",
      "conditions": {},
      "evidence": {
        "page": 99,
        "source": "source:st-stm32f103"
      },
      "unit": "mm",
      "value": 9
    },
    "lead_width": {
      "basis": "DATASHEET",
      "conditions": {},
      "evidence": {
        "page": 99,
        "source": "source:st-stm32f103"
      },
      "max": 0.27,
      "min": 0.17,
      "typ": 0.22,
      "unit": "mm"
    },
    "pin_count": 48,
    "pitch": {
      "basis": "DATASHEET",
      "conditions": {},
      "evidence": {
        "page": 99,
        "source": "source:st-stm32f103"
      },
      "unit": "mm",
      "value": 0.5
    }
  },
  "evidence": [
    {
      "page": 99,
      "source": "source:st-stm32f103"
    }
  ],
  "family": "LQFP-48",
  "generator": "gullwing_four_side",
  "id": "package:lqfp-48-stm32",
  "mount_type": "SMT",
  "pin1": "1",
  "provenance": {
    "created_by": "agent:/root/implement_pcbknowledge_brief/stage6_audit_packages",
    "verified_by": [
      "agent:/root/implement_pcbknowledge_brief/stage6_package_review"
    ]
  },
  "schema": "pcbknowledge.package.v2",
  "scope": {
    "basis": "DATASHEET",
    "evidence": [
      {
        "page": 99,
        "source": "source:st-stm32f103"
      },
      {
        "page": 104,
        "source": "source:st-stm32f103"
      }
    ],
    "mpns": [
      "STM32F103C8T6"
    ]
  },
  "verification": "AGENT_VERIFIED"
}
