{
  "body": {
    "height": {
      "basis": "DATASHEET",
      "conditions": {},
      "evidence": {
        "page": 1,
        "source": "source:yageo-rt0603brd0710kl"
      },
      "max": 0.55,
      "min": 0.35,
      "typ": 0.45,
      "unit": "mm"
    },
    "length": {
      "basis": "DATASHEET",
      "conditions": {},
      "evidence": {
        "page": 1,
        "source": "source:yageo-rt0603brd0710kl"
      },
      "max": 0.9,
      "min": 0.7,
      "typ": 0.8,
      "unit": "mm"
    },
    "width": {
      "basis": "DATASHEET",
      "conditions": {},
      "evidence": {
        "page": 1,
        "source": "source:yageo-rt0603brd0710kl"
      },
      "max": 1.7,
      "min": 1.5,
      "typ": 1.6,
      "unit": "mm"
    }
  },
  "courtyard_margin": {
    "basis": "ENGINEERING_DEFAULT",
    "conditions": {},
    "note": "ADR-024 D8 courtyard margin.",
    "unit": "mm",
    "value": 0.25
  },
  "density": "NOMINAL",
  "drawing": {
    "lead_length": {
      "basis": "DATASHEET",
      "conditions": {},
      "evidence": {
        "page": 1,
        "source": "source:yageo-rt0603brd0710kl"
      },
      "max": 0.4,
      "min": 0.1,
      "typ": 0.25,
      "unit": "mm"
    },
    "lead_span": {
      "basis": "DATASHEET",
      "conditions": {},
      "evidence": {
        "page": 1,
        "source": "source:yageo-rt0603brd0710kl"
      },
      "max": 1.7,
      "min": 1.5,
      "typ": 1.6,
      "unit": "mm"
    },
    "lead_width": {
      "basis": "DATASHEET",
      "conditions": {},
      "evidence": {
        "page": 1,
        "source": "source:yageo-rt0603brd0710kl"
      },
      "max": 0.9,
      "min": 0.7,
      "typ": 0.8,
      "unit": "mm"
    },
    "pin_count": 2
  },
  "evidence": [
    {
      "page": 1,
      "source": "source:yageo-rt0603brd0710kl"
    }
  ],
  "family": "CHIP_0603",
  "generator": "chip",
  "id": "package:yageo-rt0603brd0710kl",
  "mount_type": "SMT",
  "pin1": "1",
  "provenance": {
    "created_by": "agent:/root/research_fixed_themes",
    "notes": "Exact p1 dimensions; original chip generator lands, not copied drawing.",
    "verified_by": [
      "agent:/root/implement_reference_layout/stage12_review"
    ]
  },
  "schema": "pcbknowledge.package.v2",
  "scope": {
    "basis": "DATASHEET",
    "evidence": [
      {
        "page": 1,
        "source": "source:yageo-rt0603brd0710kl"
      }
    ],
    "mpns": [
      "RT0603BRD0710KL"
    ]
  },
  "verification": "AGENT_VERIFIED"
}
