{
  "body": {
    "height": {
      "basis": "DATASHEET",
      "conditions": {},
      "evidence": {
        "page": 18,
        "source": "source:wch-package-v4"
      },
      "max": 1.75,
      "min": 1.35,
      "note": "Page 5 general tolerance: +/- greater of 0.2 mm or 10%; pitch excluded.",
      "typ": 1.55,
      "unit": "mm"
    },
    "length": {
      "basis": "DATASHEET",
      "conditions": {},
      "evidence": {
        "page": 18,
        "source": "source:wch-package-v4"
      },
      "max": 11.0,
      "min": 9.0,
      "note": "Page 5 general tolerance: +/- greater of 0.2 mm or 10%; pitch excluded.",
      "typ": 10,
      "unit": "mm"
    },
    "width": {
      "basis": "DATASHEET",
      "conditions": {},
      "evidence": {
        "page": 18,
        "source": "source:wch-package-v4"
      },
      "max": 4.29,
      "min": 3.51,
      "note": "Page 5 general tolerance: +/- greater of 0.2 mm or 10%; pitch excluded.",
      "typ": 3.9,
      "unit": "mm"
    }
  },
  "courtyard_margin": {
    "basis": "ENGINEERING_DEFAULT",
    "conditions": {},
    "note": "D8 original courtyard allowance; not a manufacturer land pattern.",
    "unit": "mm",
    "value": 0.25
  },
  "density": "NOMINAL",
  "drawing": {
    "lead_length": {
      "basis": "DATASHEET",
      "conditions": {},
      "evidence": {
        "page": 18,
        "source": "source:wch-package-v4"
      },
      "max": 0.7,
      "min": 0.3,
      "note": "Page 5 general tolerance: +/- greater of 0.2 mm or 10%; pitch excluded.",
      "typ": 0.5,
      "unit": "mm"
    },
    "lead_span": {
      "basis": "DATASHEET",
      "conditions": {},
      "evidence": {
        "page": 18,
        "source": "source:wch-package-v4"
      },
      "max": 6.6,
      "min": 5.4,
      "note": "Page 5 general tolerance: +/- greater of 0.2 mm or 10%; pitch excluded.",
      "typ": 6,
      "unit": "mm"
    },
    "lead_width": {
      "basis": "DATASHEET",
      "conditions": {},
      "evidence": {
        "page": 18,
        "source": "source:wch-package-v4"
      },
      "max": 0.65,
      "min": 0.25,
      "note": "Page 5 general tolerance: +/- greater of 0.2 mm or 10%; pitch excluded.",
      "typ": 0.45,
      "unit": "mm"
    },
    "pin_count": 16,
    "pitch": {
      "basis": "DATASHEET",
      "conditions": {},
      "evidence": {
        "page": 18,
        "source": "source:wch-package-v4"
      },
      "unit": "mm",
      "value": 1.27
    }
  },
  "evidence": [
    {
      "page": 5,
      "source": "source:wch-package-v4"
    },
    {
      "page": 18,
      "source": "source:wch-package-v4"
    }
  ],
  "family": "SOP-16",
  "generator": "gullwing_two_side",
  "id": "package:sop-16-wch-ch340c",
  "mount_type": "SMT",
  "pin1": "1",
  "provenance": {
    "created_by": "agent:/root/implement_pcbknowledge_brief/stage6_guards",
    "verified_by": [
      "agent:/root/implement_pcbknowledge_brief/stage6_package_review"
    ]
  },
  "schema": "pcbknowledge.package.v2",
  "scope": {
    "basis": "DATASHEET",
    "evidence": [
      {
        "page": 2,
        "source": "source:wch-ch340-v3d"
      },
      {
        "page": 1,
        "source": "source:wch-package-v4"
      },
      {
        "page": 18,
        "source": "source:wch-package-v4"
      }
    ],
    "mpns": [
      "CH340C"
    ]
  },
  "verification": "AGENT_VERIFIED"
}
