{
  "body": {
    "height": {
      "basis": "DATASHEET",
      "conditions": {},
      "evidence": {
        "page": 1,
        "source": "source:kemet-c0603c220j5gactu"
      },
      "max": 0.87,
      "min": 0.73,
      "typ": 0.8,
      "unit": "mm"
    },
    "length": {
      "basis": "DATASHEET",
      "conditions": {},
      "evidence": {
        "page": 1,
        "source": "source:kemet-c0603c220j5gactu"
      },
      "max": 0.95,
      "min": 0.65,
      "typ": 0.8,
      "unit": "mm"
    },
    "width": {
      "basis": "DATASHEET",
      "conditions": {},
      "evidence": {
        "page": 1,
        "source": "source:kemet-c0603c220j5gactu"
      },
      "max": 1.75,
      "min": 1.45,
      "typ": 1.6,
      "unit": "mm"
    }
  },
  "courtyard_margin": {
    "basis": "ENGINEERING_DEFAULT",
    "conditions": {},
    "note": "ADR-024 D8 courtyard margin.",
    "unit": "mm",
    "value": 0.25
  },
  "density": "NOMINAL",
  "drawing": {
    "lead_length": {
      "basis": "DATASHEET",
      "conditions": {},
      "evidence": {
        "page": 1,
        "source": "source:kemet-c0603c220j5gactu"
      },
      "max": 0.5,
      "min": 0.2,
      "typ": 0.35,
      "unit": "mm"
    },
    "lead_span": {
      "basis": "DATASHEET",
      "conditions": {},
      "evidence": {
        "page": 1,
        "source": "source:kemet-c0603c220j5gactu"
      },
      "max": 1.75,
      "min": 1.45,
      "typ": 1.6,
      "unit": "mm"
    },
    "lead_width": {
      "basis": "DATASHEET",
      "conditions": {},
      "evidence": {
        "page": 1,
        "source": "source:kemet-c0603c220j5gactu"
      },
      "max": 0.95,
      "min": 0.65,
      "typ": 0.8,
      "unit": "mm"
    },
    "pin_count": 2
  },
  "evidence": [
    {
      "page": 1,
      "source": "source:kemet-c0603c220j5gactu"
    },
    {
      "page": 1,
      "source": "source:kemet-c0603c101j5gactu"
    }
  ],
  "family": "CHIP_0603",
  "generator": "chip",
  "id": "package:chip-0603-kemet-c0g",
  "mount_type": "SMT",
  "pin1": "1",
  "provenance": {
    "created_by": "agent:/root/implement_pcbknowledge_brief/stage6_audit_packages",
    "notes": "D70 revision by agent:/root/implement_reference_layout/placer_draft; independently verified exact 100 pF source, unchanged package geometry, electrical envelopes and layout bounds.",
    "verified_by": [
      "agent:/root/implement_pcbknowledge_brief/stage6_package_review",
      "agent:/root/implement_reference_layout/placement_review"
    ]
  },
  "schema": "pcbknowledge.package.v2",
  "scope": {
    "basis": "DATASHEET",
    "evidence": [
      {
        "page": 1,
        "source": "source:kemet-c0603c220j5gactu"
      },
      {
        "page": 1,
        "source": "source:kemet-c0603c101j5gactu"
      }
    ],
    "mpns": [
      "C0603C220J5GACTU",
      "C0603C101J5GACTU"
    ]
  },
  "verification": "AGENT_VERIFIED"
}
