{
  "body": {
    "height": {
      "basis": "DATASHEET",
      "conditions": {},
      "evidence": {
        "page": 23,
        "source": "source:ti-tps562201"
      },
      "max": 1.1,
      "unit": "mm"
    },
    "length": {
      "basis": "DATASHEET",
      "conditions": {},
      "evidence": {
        "page": 23,
        "source": "source:ti-tps562201"
      },
      "max": 3.05,
      "min": 2.75,
      "unit": "mm"
    },
    "width": {
      "basis": "DATASHEET",
      "conditions": {},
      "evidence": {
        "page": 23,
        "source": "source:ti-tps562201"
      },
      "max": 1.75,
      "min": 1.45,
      "unit": "mm"
    }
  },
  "courtyard_margin": {
    "basis": "ENGINEERING_DEFAULT",
    "conditions": {},
    "note": "D8 nominal allowance around body and derived lands.",
    "unit": "mm",
    "value": 0.25
  },
  "density": "NOMINAL",
  "drawing": {
    "lead_length": {
      "basis": "DATASHEET",
      "conditions": {},
      "evidence": {
        "page": 23,
        "source": "source:ti-tps562201"
      },
      "max": 0.6,
      "min": 0.3,
      "unit": "mm"
    },
    "lead_span": {
      "basis": "DATASHEET",
      "conditions": {},
      "evidence": {
        "page": 23,
        "source": "source:ti-tps562201"
      },
      "max": 3.05,
      "min": 2.55,
      "unit": "mm"
    },
    "lead_width": {
      "basis": "DATASHEET",
      "conditions": {},
      "evidence": {
        "page": 23,
        "source": "source:ti-tps562201"
      },
      "max": 0.5,
      "min": 0.3,
      "unit": "mm"
    },
    "pin_count": 6,
    "pitch": {
      "basis": "DATASHEET",
      "conditions": {},
      "evidence": {
        "page": 23,
        "source": "source:ti-tps562201"
      },
      "unit": "mm",
      "value": 0.95
    }
  },
  "evidence": [
    {
      "page": 23,
      "source": "source:ti-tps562201"
    }
  ],
  "family": "SOT-23-6",
  "generator": "gullwing_two_side",
  "id": "package:ti-tps562208ddcr",
  "mount_type": "SMT",
  "pin1": "1",
  "provenance": {
    "created_by": "agent:/root/research_fixed_themes",
    "notes": "Same TI DDC0006A6-pin package; exactTPS562208DDCR identity p26, mechanicalp23. FCCM alternative to Eco-mode201.",
    "verified_by": []
  },
  "schema": "pcbknowledge.package.v2",
  "scope": {
    "basis": "DATASHEET",
    "evidence": [
      {
        "page": 26,
        "source": "source:ti-tps562201"
      },
      {
        "page": 23,
        "source": "source:ti-tps562201"
      }
    ],
    "mpns": [
      "TPS562208DDCR"
    ]
  },
  "verification": "DRAFT"
}
