{
  "body": {
    "height": {
      "basis": "DATASHEET",
      "conditions": {},
      "evidence": {
        "page": 1,
        "source": "source:wurth-150060rs75000"
      },
      "max": 0.8,
      "min": 0.6,
      "typ": 0.7,
      "unit": "mm"
    },
    "length": {
      "basis": "DATASHEET",
      "conditions": {},
      "evidence": {
        "page": 1,
        "source": "source:wurth-150060rs75000"
      },
      "max": 0.9,
      "min": 0.7,
      "typ": 0.8,
      "unit": "mm"
    },
    "width": {
      "basis": "DATASHEET",
      "conditions": {},
      "evidence": {
        "page": 1,
        "source": "source:wurth-150060rs75000"
      },
      "max": 1.7,
      "min": 1.5,
      "typ": 1.6,
      "unit": "mm"
    }
  },
  "courtyard_margin": {
    "basis": "ENGINEERING_DEFAULT",
    "conditions": {},
    "note": "G1 D8 courtyard allowance.",
    "unit": "mm",
    "value": 0.25
  },
  "density": "NOMINAL",
  "drawing": {
    "lead_length": {
      "basis": "DATASHEET",
      "conditions": {},
      "evidence": {
        "page": 1,
        "source": "source:wurth-150060rs75000"
      },
      "max": 0.55,
      "min": 0.35,
      "note": "Symmetric terminal length derived from total length1.6±0.1 minus inner gap0.7±0.1, divided by2.",
      "typ": 0.45,
      "unit": "mm"
    },
    "lead_span": {
      "basis": "DATASHEET",
      "conditions": {},
      "evidence": {
        "page": 1,
        "source": "source:wurth-150060rs75000"
      },
      "max": 1.7,
      "min": 1.5,
      "typ": 1.6,
      "unit": "mm"
    },
    "lead_width": {
      "basis": "DATASHEET",
      "conditions": {},
      "evidence": {
        "page": 1,
        "source": "source:wurth-150060rs75000"
      },
      "typ": 0.7,
      "unit": "mm"
    },
    "pin_count": 2
  },
  "evidence": [
    {
      "page": 1,
      "source": "source:wurth-150060rs75000"
    }
  ],
  "family": "CHIP_0603",
  "generator": "chip",
  "id": "package:chip-0603-wurth-led",
  "mount_type": "SMT",
  "pin1": "1",
  "provenance": {
    "created_by": "agent:/root/implement_pcbknowledge_brief/stage6_audit_packages",
    "verified_by": [
      "agent:/root/implement_pcbknowledge_brief/stage6_package_review"
    ]
  },
  "schema": "pcbknowledge.package.v2",
  "scope": {
    "basis": "DATASHEET",
    "evidence": [
      {
        "page": 1,
        "source": "source:wurth-150060rs75000"
      }
    ],
    "mpns": [
      "150060RS75000"
    ]
  },
  "verification": "AGENT_VERIFIED"
}
