{
  "body": {
    "height": {
      "basis": "DATASHEET",
      "conditions": {},
      "evidence": {
        "page": 1,
        "source": "source:bourns-mh2029-t"
      },
      "max": 1.05,
      "min": 0.65,
      "typ": 0.85,
      "unit": "mm"
    },
    "length": {
      "basis": "DATASHEET",
      "conditions": {},
      "evidence": {
        "page": 1,
        "source": "source:bourns-mh2029-t"
      },
      "max": 1.45,
      "min": 1.05,
      "typ": 1.25,
      "unit": "mm"
    },
    "width": {
      "basis": "DATASHEET",
      "conditions": {},
      "evidence": {
        "page": 1,
        "source": "source:bourns-mh2029-t"
      },
      "max": 2.2,
      "min": 1.8,
      "typ": 2,
      "unit": "mm"
    }
  },
  "courtyard_margin": {
    "basis": "ENGINEERING_DEFAULT",
    "conditions": {},
    "note": "Nominal courtyard allowance.",
    "unit": "mm",
    "value": 0.25
  },
  "density": "COMPACT",
  "drawing": {
    "lead_length": {
      "basis": "DATASHEET",
      "conditions": {},
      "evidence": {
        "page": 1,
        "source": "source:bourns-mh2029-t"
      },
      "max": 0.8,
      "min": 0.2,
      "typ": 0.5,
      "unit": "mm"
    },
    "lead_span": {
      "basis": "DATASHEET",
      "conditions": {},
      "evidence": {
        "page": 1,
        "source": "source:bourns-mh2029-t"
      },
      "max": 2.2,
      "min": 1.8,
      "typ": 2,
      "unit": "mm"
    },
    "lead_width": {
      "basis": "DATASHEET",
      "conditions": {},
      "evidence": {
        "page": 1,
        "source": "source:bourns-mh2029-t"
      },
      "max": 1.45,
      "min": 1.05,
      "typ": 1.25,
      "unit": "mm"
    },
    "pin_count": 2
  },
  "evidence": [
    {
      "page": 1,
      "source": "source:bourns-mh2029-t"
    }
  ],
  "family": "CHIP_0805",
  "generator": "chip",
  "id": "package:chip-0805-bourns-mh2029",
  "mount_type": "SMT",
  "pin1": "1",
  "provenance": {
    "created_by": "agent:/root/implement_pcbknowledge_brief/g3_analog_author",
    "notes": "D59 compact chip fillets preserve maximum lead-contact coverage while leaving 0.20 mm opposing-pad copper clearance.",
    "verified_by": [
      "agent:/root/implement_pcbknowledge_brief/g3_source_review"
    ]
  },
  "schema": "pcbknowledge.package.v2",
  "scope": {
    "basis": "DATASHEET",
    "evidence": [
      {
        "page": 1,
        "source": "source:bourns-mh2029-t"
      }
    ],
    "mpns": [
      "MH2029-601T"
    ]
  },
  "verification": "AGENT_VERIFIED"
}
